,movieId,title,genres,year,abstract
6453,52281,Grindhouse,"Action, Crime, Horror, Sci-Fi, Thriller",2007,"Grindhouse is a 2007 American horror film double feature co-written, produced, and directed by Robert Rodriguez and Quentin Tarantino. The double feature consists of two feature-length segments, Rodriguez's Planet Terror and Tarantino's Death Proof, and is bookended by fictional trailers for upcoming attractions, advertisements, and in-theater announcements. The film's title derives from the U.S. film industry term ""grindhouse"", which refers to (now mostly defunct) movie theaters specializing in B movies, often exploitation films, shown in a multiple-feature format. The film stars Rose McGowan, Freddy Rodriguez, Marley Shelton, Michael Biehn, Jeff Fahey, Josh Brolin, Naveen Andrews, Fergie, Bruce Willis, Kurt Russell, Rosario Dawson, Tracie Thoms, Mary Elizabeth Winstead, and stuntwoman Zoë Bell, who plays herself. Rodriguez's segment, Planet Terror, revolves around an outfit of rebels attempting to survive an onslaught of zombie-like creatures as they feud with a rogue military unit, while Tarantino's segment, Death Proof, focuses on a misogynistic, psychopathic stuntman who targets young women, murdering them with his ""death proof"" stunt car. Each feature is preceded by faux trailers of exploitation films in other genres that were developed by other directors. After the film was released on April 6, 2007, ticket sales performed significantly below box office analysts' expectations despite mostly positive critic reviews. In much of the rest of the world, each feature was released separately in extended versions. Two soundtracks were also released for the features and include music and audio snippets from the film. The feature later found more success on DVD and Blu-ray. In several interviews, despite the box office failure, the directors have expressed their interest in a possible sequel to the film due to its critical acclaim and successful home media sales. Three spin-off films were later made, based on Grindhouse's fake trailers: Machete, Machete Kills and Hobo with a Shotgun."
6454,52283,"Reaping, The","Horror, Thriller",2007,Movie not found on DBpedia by query title.
6455,52287,Meet the Robinsons,"Action, Adventure, Animation, Children, Comedy, Sci-Fi",2007,Movie not found on DBpedia by query title.
6456,52299,American Hardcore,Documentary,2006,Movie not found on DBpedia by query title.
6457,52319,Inglorious Bastards (Quel maledetto treno blindato),"Action, Adventure, Drama, War",1978,Movie not found on DBpedia by query title.
6458,52328,Sunshine,"Adventure, Drama, Sci-Fi, Thriller",2007,"Sunshine is a 1999 historical drama film written by Israel Horovitz and István Szabó, directed and produced by Szabó. It follows three generations of a Jewish family (originally called Sonnenschein, a name that literally means ""sunshine"" in German, but later changed to Sors, meaning ""fate"" or ""destiny"" in Hungarian) during the changes in Hungary from the beginning of the 20th century to the period after the 1956 Hungarian Revolution. The central male protagonist of all three generations is portrayed by Ralph Fiennes. The film also stars the real-life mother and daughter team of Rosemary Harris and Jennifer Ehle as well as Rachel Weisz and John Neville. Although fictional, the film weaves events drawn from several real sources into the story. The Sunshine family's liquor business was based on the Zwack family's liquor brand Unicum. One of Fiennes's three roles is based at least partly on Hungarian Olympian Attila Petschauer, but also includes allusions to the early life of Miksa Fenyő and other famous Hungarians of Jewish origin who suffered from anti-Semitism and the persecution of Jews in World War II Hungary. Another role in the film which is similar to that of a historic person is the character Andor Knorr played by William Hurt which closely resembles the latter part of the life of László Rajk. The film was an international co-production among companies from Germany, Austria, Hungary, and Canada. It won the Genie Award for Best Canadian Film."
6459,52375,"Hoax, The","Crime, Drama",2007,Movie not found on DBpedia by query title.
6460,52435,How the Grinch Stole Christmas!,"Animation, Comedy, Fantasy, Musical",1966,Movie not found on DBpedia by query title.
6461,52458,Disturbia,"Drama, Thriller",2007,"Disturbia is a 2007 American thriller film directed by D. J. Caruso, written by Christopher Landon and Carl Ellsworth and stars Shia LaBeouf, David Morse, Sarah Roemer and Carrie-Anne Moss. The film follows a teenager who is placed on house arrest and begins to spy on his neighbors, thinking one of them is a serial killer. Partly inspired by Alfred Hitchcock's Rear Window, the film was released on April 13, 2007."
6462,52462,Aqua Teen Hunger Force Colon Movie Film for Theaters,"Action, Adventure, Animation, Comedy, Fantasy, Mystery, Sci-Fi",2007,Movie not found on DBpedia by query title.
6463,52579,"Vie en Rose, La (Môme, La)","Drama, Musical",2007,Movie not found on DBpedia by query title.
6464,52604,Fracture,"Crime, Drama, Mystery, Thriller",2007,"Fracture is a 2004 New Zealand film written and directed by Larry Parr and based on the novel by Maurice Gee. The film is set in Wellington and stars Kate Elliott, Jared Turner and Australian John Noble. The film was met with positive reviews and was the second highest grossing local film at the New Zealand box office in 2004 behind In My Father's Den."
6465,52644,Vacancy,"Horror, Thriller",2007,"Vacancy is a 2007 American horror film directed by Nimród Antal and starring Kate Beckinsale and Luke Wilson. It was released April 20, 2007, by the distributor Screen Gems. Early in the film's development, it was thought Sarah Jessica Parker would star; but, in September 2006, The Hollywood Reporter announced Kate Beckinsale had been signed instead."
6466,52668,In the Land of Women,"Comedy, Drama, Romance",2007,Movie not found on DBpedia by query title.
6467,52694,Mr. Bean's Holiday,Comedy,2007,Movie not found on DBpedia by query title.
6468,52712,"Invisible, The","Crime, Drama, Fantasy, Mystery, Thriller",2007,Movie not found on DBpedia by query title.
6469,52715,Kickin It Old Skool,Comedy,2007,Movie not found on DBpedia by query title.
6470,52722,Spider-Man 3,"Action, Adventure, Sci-Fi, Thriller, IMAX",2007,Movie not found on DBpedia by query title.
6471,52724,Lucky You,"Comedy, Drama",2007,Movie not found on DBpedia by query title.
6472,52730,It's a Very Merry Muppet Christmas Movie,"Children, Comedy",2002,Movie not found on DBpedia by query title.
6473,52767,21 Up,Documentary,1977,Movie not found on DBpedia by query title.
6474,52784,Sharkwater,Documentary,2006,"Sharkwater is a 2006 Canadian documentary film written and directed by Rob Stewart. Helping to protect sharks, changing government policy, and inspiring the creation of shark conservation groups, Sharkwater is considered one of conservation's success stories, resulting in shark finning being banned worldwide. In the film, Stewart filmed current attitudes about sharks, and how shark-hunting industries are driving them to extinction. Sharkwater explores the densest shark hunting populations in the world, exposing the exploitation and corruption of the shark-hunting industry in the marine reserves of Cocos Island, Costa Rica and the Galapagos Islands, Ecuador. Stewart travels with Paul Watson and his Sea Shepherd Conservation Society ship as they confront shark poachers in Guatemala and Costa Rica. Among the group's experiences are boat confrontations poachers, police, corrupt court systems, and eventually murder charges. Also, Stewart states how the increasing demand for shark-fin soup in Asia is fuelling an illegal trade in sharks. His expedition is cut short, however, when he is diagnosed with necrotizing fasciitis, from which he recovers. Stewart discovers that sharks prevent the overconsumption of plankton by other fish, which moderates climate change. Yet sharks have gone from predator to prey, and while they have survived Earth's mass extinctions, they could be extinct within a few years. The film has received 31 international awards."
6475,52831,Maniac Cop,"Action, Crime, Horror, Thriller",1988,Movie not found on DBpedia by query title.
6476,52867,"Ex, The","Comedy, Romance",2007,Movie not found on DBpedia by query title.
6477,52885,Paprika (Papurika),"Animation, Mystery, Sci-Fi",2006,Movie not found on DBpedia by query title.
6478,52950,Day Watch (Dnevnoy dozor),"Action, Fantasy, Horror, Thriller",2006,Movie not found on DBpedia by query title.
6479,52952,This Is England,Drama,2006,Movie not found on DBpedia by query title.
6480,52967,Away from Her,Drama,2006,Movie not found on DBpedia by query title.
6481,52973,Knocked Up,"Comedy, Drama, Romance",2007,Movie not found on DBpedia by query title.
6482,52975,Hairspray,"Comedy, Drama, Musical",2007,"Hairspray is a 1988 American romantic musical comedy film written and directed by John Waters, and starring Ricki Lake, Divine, Debbie Harry, Sonny Bono, Jerry Stiller, Leslie Ann Powers, Colleen Fitzpatrick, and Michael St. Gerard. Hairspray was a dramatic departure from Waters' earlier works, with a much broader intended audience. In fact, Hairspray's PG is the mildest rating a Waters film has received; most of his previous films were rated X by the MPAA. Set in 1962 Baltimore, Maryland, the film revolves around self-proclaimed ""pleasantly plump"" teenager Tracy Turnblad as she pursues stardom as a dancer on a local TV show and rallies against racial segregation. Hairspray was only a moderate success upon its initial theatrical release, earning a modest gross of $8 million. However, it managed to attract a larger audience on home video in the early 1990s and became a cult classic. Most critics praised the film, although some were displeased with the overall campiness. The film also ranks #444 on Empire magazine's 2008 list of the 500 greatest movies of all time. In 2002, the film was adapted into a Broadway musical of the same name, which won eight Tony Awards, including Best Musical in 2003. A second film version of Hairspray, an adaptation of the stage musical, was also released by New Line Cinema in 2007, which included many changes of scripted items from the original."
6483,53000,28 Weeks Later,"Horror, Sci-Fi, Thriller",2007,Movie not found on DBpedia by query title.
6484,53022,Wheels on Meals (Kuai can che),"Action, Comedy, Crime, Romance",1984,Movie not found on DBpedia by query title.
6485,53024,Jonestown: The Life and Death of Peoples Temple,Documentary,2006,Movie not found on DBpedia by query title.
6486,53121,Shrek the Third,"Adventure, Animation, Children, Comedy, Fantasy",2007,Movie not found on DBpedia by query title.
6487,53123,Once,"Drama, Musical, Romance",2006,"Once is a 2007 Irish musical romance film written and directed by John Carney. The film stars Glen Hansard and Markéta Irglová as two struggling musicians in Dublin, Ireland. Hansard and Irglová had previously performed music as the Swell Season, and composed and performed the film's original songs. Once spent years in development with the Irish Film Board and was made for a budget of €112,000. It was a commercial success, earning substantial per-screen box office averages in the United States. It received awards including the 2007 Independent Spirit Award for Best Foreign Film. Hansard and Irglová's song ""Falling Slowly"" won the 2007 Academy Award for Best Original Song, and the soundtrack received a Grammy Award nomination."
6488,53125,Pirates of the Caribbean: At World's End,"Action, Adventure, Comedy, Fantasy",2007,Movie not found on DBpedia by query title.
6489,53127,Bug,"Drama, Horror, Thriller",2007,"Bug is a 1975 American horror film in Panavision, directed by Jeannot Szwarc and written by William Castle and Thomas Page, from Page's 1973 novel The Hephaestus Plague. It was the last film Castle was involved in before his death. The film starred Bradford Dillman, Joanna Miles and Richard Gilliland."
6490,53129,Mr. Brooks,"Crime, Drama, Thriller",2007,Movie not found on DBpedia by query title.
6491,53138,"Librarian: Return to King Solomon's Mines, The","Action, Adventure, Fantasy",2006,Movie not found on DBpedia by query title.
6492,53140,"Librarian: Quest for the Spear, The","Action, Adventure, Comedy, Fantasy, Romance",2004,Movie not found on DBpedia by query title.
6493,53143,Fay Grim,"Action, Thriller",2006,Movie not found on DBpedia by query title.
6494,53161,"I'm a Cyborg, But That's OK (Saibogujiman kwenchana)","Comedy, Drama, Romance, Sci-Fi",2006,Movie not found on DBpedia by query title.
6495,53280,"Breed, The","Horror, Thriller",2006,Movie not found on DBpedia by query title.
6496,53318,Cashback,"Comedy, Drama, Romance",2006,"Cashback is a 2006 British romantic comedy-drama film written and directed by Sean Ellis. Originally exhibited as a short in 2004, it was expanded to feature length in 2006. Both versions were produced by Lene Bausager, starring Sean Biggerstaff and Emilia Fox. The feature was released by Magnolia Pictures in late 2006 and also starred Michelle Ryan."
6497,53322,Ocean's Thirteen,"Crime, Thriller",2007,Movie not found on DBpedia by query title.
6498,53326,Them (Ils),Horror,2006,Movie not found on DBpedia by query title.
6499,53355,Sun Alley (Sonnenallee),"Comedy, Romance",1999,Movie not found on DBpedia by query title.
6500,53435,Hostel: Part II,"Crime, Horror, Thriller",2007,Movie not found on DBpedia by query title.
6501,53447,Paranoid Park,"Crime, Drama",2007,Movie not found on DBpedia by query title.
6502,53450,"Legend of Sleepy Hollow, The","Comedy, Fantasy, Horror",1980,Movie not found on DBpedia by query title.
6503,53453,Starcrash (a.k.a. Star Crash),"Action, Adventure, Fantasy, Sci-Fi",1978,Movie not found on DBpedia by query title.
6504,53460,Surf's Up,"Animation, Children, Comedy",2007,Movie not found on DBpedia by query title.
6505,53464,Fantastic Four: Rise of the Silver Surfer,"Action, Adventure, Sci-Fi",2007,Movie not found on DBpedia by query title.
6506,53466,Nancy Drew,"Adventure, Crime, Thriller",2007,Movie not found on DBpedia by query title.
6507,53468,Fido,"Comedy, Horror, Thriller",2006,"Fido is a 2006 Canadian zombie comedy film directed by Andrew Currie and written by Robert Chomiak, Currie, and Dennis Heaton from an original story by Heaton. It was produced by Blake Corbet, Mary Anne Waterhouse, Trent Carlson and Kevin Eastwood of Anagram Pictures, and released in the United States by Lions Gate Entertainment."
6508,53519,Death Proof,"Action, Adventure, Crime, Horror, Thriller",2007,Movie not found on DBpedia by query title.
6509,53550,Rescue Dawn,"Action, Adventure, Drama, War",2006,Movie not found on DBpedia by query title.
6510,53574,"TV Set, The","Comedy, Drama",2006,Movie not found on DBpedia by query title.
6511,53578,"Valet, The (La doublure)",Comedy,2006,Movie not found on DBpedia by query title.
6512,53808,Bring It On: All or Nothing,Comedy,2006,Movie not found on DBpedia by query title.
6513,53883,"Power of Nightmares, The: The Rise of the Politics of Fear",Documentary,2004,Movie not found on DBpedia by query title.
6514,53894,Sicko,"Documentary, Drama",2007,"Sicko is a 2007 documentary film by American filmmaker Michael Moore. The film investigates health care in the United States, focusing on its health insurance and the pharmaceutical industry. The movie compares the for-profit, non-universal U.S. system with the non-profit universal health care systems of Canada, the United Kingdom, France and Cuba. Sicko was made on a budget of approximately $9 million, and grossed $24.5 million theatrically in the United States. This box office take exceeded the official expectation of The Weinstein Company, which had hoped for a gross in line with Bowling for Columbine's $21.5 million US box office gross."
6515,53921,"Mighty Heart, A","Drama, Thriller",2007,Movie not found on DBpedia by query title.
6516,53953,1408,"Drama, Horror, Thriller",2007,"1408 is a 2007 American psychological horror film based on Stephen King's 1999 short story of the same name. It is directed by Swedish director Mikael Håfström and stars John Cusack, Samuel L. Jackson, Mary McCormack, Tony Shalhoub, Len Cariou, Isiah Whitlock, Jr., and Jasmine Jessica Anthony. The film was released in the United States on June 22, 2007, although July 13 is mentioned as the release date on the website. The film follows Mike Enslin, an author who specializes in the horror genre. His career is essentially based on investigating allegedly haunted houses, although his repeatedly fruitless studies have left him disillusioned and pessimistic. Through an anonymous warning via postcard, Mike learns of the Dolphin Hotel in New York City, which houses the infamous ""Room 1408"". Interested but skeptical, he decides to spend one night in the room, although manager Gerald Olin warns him strongly against it. The film follows Mike's series of bizarre experiences in room 1408."
6517,53956,Death at a Funeral,Comedy,2007,Movie not found on DBpedia by query title.
6518,53972,Live Free or Die Hard,"Action, Adventure, Crime, Thriller",2007,Movie not found on DBpedia by query title.
6519,53974,License to Wed,"Comedy, Romance",2007,Movie not found on DBpedia by query title.
6520,53993,Evan Almighty,"Comedy, Fantasy",2007,Movie not found on DBpedia by query title.
6521,53996,Transformers,"Action, Sci-Fi, Thriller, IMAX",2007,"Transformers is a 2007 American science fiction action film based on the Transformers toy line. The film, which combines computer animation with live-action, is directed by Michael Bay, with Steven Spielberg serving as executive producer. It is the first installment of the live-action Transformers film series. It stars Shia LaBeouf as Sam Witwicky, a teenager who gets caught up in a war between the heroic Autobots and the villainous Decepticons, two factions of alien robots who can disguise themselves by transforming into everyday machinery, primarily vehicles. The Autobots intend to use the AllSpark, the object that created their robotic race, in an attempt to rebuild Cybertron and end the war while the Decepticons desire control of the AllSpark with the intention of using it to build an army by giving life to the machines of Earth. Tyrese Gibson, Josh Duhamel, Anthony Anderson, Megan Fox, Rachael Taylor, John Turturro, and Jon Voight also star while voice actors Peter Cullen and Hugo Weaving voice Optimus Prime and Megatron respectively. The film was produced by Don Murphy and Tom DeSanto. They developed the project in 2003, and DeSanto wrote a treatment. Steven Spielberg came on board the following year, hiring Roberto Orci and Alex Kurtzman to write the screenplay. The U.S. Armed Forces and General Motors (GM) loaned vehicles and aircraft during filming, which saved money for the production and added realism to the battle scenes. Hasbro's promotional campaign for the film included deals with hundreds of companies. Advertising included a viral marketing campaign, coordinated releases of prequel comic books, toys, and books, as well as product placement deals with GM, Burger King, and eBay. Transformers received mixed to positive reviews from critics and fans, and is the forty-fifth highest-grossing film and the fifth highest-grossing film of 2007, grossing approximately $709 million worldwide, with an estimated 46 million tickets sold in the US. The film won four awards from the Visual Effects Society and was nominated for three Academy Awards, for Best Sound Editing, Best Sound Mixing, and Best Visual Effects. LaBeouf's performance was praised by Empire, and Cullen's reprisal of Optimus Prime from the 1980s television series was well received by fans. A sequel, Revenge of the Fallen, was released on June 24, 2009. A third film, Dark of the Moon, was released on June 29, 2011, in 3-D and went on to gross over $1 billion. A fourth entry, Age of Extinction, was released on June 27, 2014, which also grossed over $1 billion. A fifth installment, titled Transformers: The Last Knight, is scheduled for a Summer 2017 release."
6522,54001,Harry Potter and the Order of the Phoenix,"Adventure, Drama, Fantasy, IMAX",2007,Movie not found on DBpedia by query title.
6523,54004,I Now Pronounce You Chuck and Larry,"Comedy, Romance",2007,Movie not found on DBpedia by query title.
6524,54116,First Snow,"Drama, Thriller",2006,Movie not found on DBpedia by query title.
6525,54121,Broken Arrow,"Drama, Romance, Western",1950,Movie not found on DBpedia by query title.
6526,54185,Manufactured Landscapes,Documentary,2006,Movie not found on DBpedia by query title.
6527,54190,Across the Universe,"Drama, Fantasy, Musical, Romance",2007,Movie not found on DBpedia by query title.
6528,54256,Hot Rod,Comedy,2007,Movie not found on DBpedia by query title.
6529,54259,Stardust,"Adventure, Comedy, Fantasy, Romance",2007,"Stardust is a 1974 British film directed by Michael Apted and starring David Essex and Adam Faith. The film is the sequel to the 1973 film That'll Be the Day. Its tagline is: ""Show me a boy who never wanted to be a rock star and I'll show you a liar."""
6530,54272,"Simpsons Movie, The","Animation, Comedy",2007,Movie not found on DBpedia by query title.
6531,54274,I Know Who Killed Me,"Crime, Drama, Thriller",2007,Movie not found on DBpedia by query title.
6532,54276,No Reservations,"Comedy, Drama, Romance",2007,Movie not found on DBpedia by query title.
6533,54281,Charlie Bartlett,"Comedy, Drama",2007,Movie not found on DBpedia by query title.
6534,54286,"Bourne Ultimatum, The","Action, Crime, Thriller",2007,Movie not found on DBpedia by query title.
6535,54354,China Blue,Documentary,2005,Movie not found on DBpedia by query title.
6536,54372,Tell No One (Ne le dis à personne),"Crime, Drama, Mystery, Thriller",2006,Movie not found on DBpedia by query title.
6537,54503,Superbad,Comedy,2007,"Superbad is a 2007 American comedy film directed by Greg Mottola and starring Jonah Hill and Michael Cera. The film was written by Seth Rogen and Evan Goldberg, who began working on the script when they were both 13 years old; they completed a draft by the time they were 15. The film's main characters have the same given names as Rogen and Goldberg. It was also one of a string of hit films produced by Judd Apatow."
6538,54617,"Brice Man, The (Brice de Nice)",Comedy,2005,Movie not found on DBpedia by query title.
6539,54648,Rush Hour 3,"Action, Comedy, Crime, Thriller",2007,Movie not found on DBpedia by query title.
6540,54686,"Last Legion, The","Action, Adventure, Fantasy, War",2007,Movie not found on DBpedia by query title.
6541,54732,Balls of Fury,Comedy,2007,Movie not found on DBpedia by query title.
6542,54734,Sydney White,Comedy,2007,Movie not found on DBpedia by query title.
6543,54736,"Kingdom, The","Action, Drama, Thriller",2007,Movie not found on DBpedia by query title.
6544,54745,Rocket Science,"Comedy, Drama",2007,Movie not found on DBpedia by query title.
6545,54768,Daddy Day Camp,"Children, Comedy",2007,Movie not found on DBpedia by query title.
6546,54771,"Invasion, The","Action, Drama, Horror, Sci-Fi, Thriller",2007,Movie not found on DBpedia by query title.
6547,54780,"Nanny Diaries, The","Comedy, Drama, Romance",2007,Movie not found on DBpedia by query title.
6548,54785,Halloween,Horror,2007,"Halloween is a 1978 American independent slasher film directed and scored by John Carpenter, co-written with producer Debra Hill, and starring Donald Pleasence and Jamie Lee Curtis in her film debut. The film was the first installment in what has become the Halloween franchise. The plot is set in the fictional Midwestern town of Haddonfield, Illinois. On Halloween night in 1963, a six-year-old Michael Myers inexplicably murders his sister and is committed. Fifteen years later, he escapes and returns home to kill again, all the while eluding his psychiatrist, Dr. Sam Loomis, who suspects Michael's intentions, following him back to Haddonfield. Halloween was produced on a budget of $300,000 and grossed $47 million at the box office in the United States, and $70 million worldwide, equivalent to roughly $267 million as of 2016, becoming one of the most profitable independent films. Many critics credit the film as the first in a long line of slasher films inspired by Alfred Hitchcock's Psycho (1960). Halloween had many imitators and originated several clichés found in low-budget horror films of the 1980s and 1990s. Unlike many of its imitators, Halloween contains little graphic violence and gore. It was one of the first horror films to introduce the concept of the killer dying and coming back to life again within the same film. In 2006, it was selected for preservation in the United States National Film Registry by the Library of Congress as being ""culturally, historically, or aesthetically significant"". Some critics have suggested that Halloween may encourage sadism and misogyny by audiences identifying with its villain. Other critics have suggested the film is a social critique of the immorality of youth and teenagers in 1970s America, with many of Myers' victims being sexually promiscuous substance abusers, while the lone heroine is depicted as innocent and pure, hence her survival. Nevertheless, Carpenter dismisses such analyses. Several of Halloween's techniques and plot elements, although not founded in this film, have nonetheless become standard slasher movie tropes. Halloween spawned seven sequels and was rebooted by Rob Zombie in 2007. The first sequel to the original movie, Halloween II, was released in 1981, three years after its predecessor."
6549,54787,Death Sentence,"Drama, Thriller",2007,Movie not found on DBpedia by query title.
6550,54796,2 Days in Paris,"Comedy, Drama, Romance",2007,Movie not found on DBpedia by query title.
6551,54881,"King of Kong, The",Documentary,2007,Movie not found on DBpedia by query title.
