,movieId,title,genres,year,abstract
7000,67665,Anvil! The Story of Anvil,"Documentary, Musical",2008,Movie not found on DBpedia by query title.
7001,67695,Observe and Report,"Action, Comedy",2009,Movie not found on DBpedia by query title.
7002,67734,Adventureland,"Comedy, Drama",2009,"Adventureland is a 2009 American comedy-drama film written and directed by Greg Mottola, starring Jesse Eisenberg and Kristen Stewart and co-starring Ryan Reynolds, Kristen Wiig, Bill Hader, Martin Starr, and Margarita Levieva. The film is set in the summer of 1987 when recent college grad James Brennan (Jesse Eisenberg) is making big plans to tour Europe and attend graduate school in pursuit of a career in journalism. However, financial problems force him to look for a summer job instead of traveling abroad, which places him at Adventureland, a run-down amusement park in western Pennsylvania. There he meets Emily Lewin (Kristen Stewart), a co-worker with whom he develops a quick rapport and relationship. Released on April 3, 2009, the film received positive reviews and earned $17.1 million worldwide at the box office. Adventureland was less successful than Greg Mottola's previous film, the 2007 box-office hit Superbad, with a smaller release on 1,862 screens. It was nominated for ""Best Ensemble Cast Performance"" at the 19th Annual Gotham Independent Film Awards."
7003,67788,Confessions of a Shopaholic,"Comedy, Romance",2009,Movie not found on DBpedia by query title.
7004,67799,The Butterfly Effect 3: Revelations,"Drama, Fantasy, Sci-Fi, Thriller",2009,Movie not found on DBpedia by query title.
7005,67888,Man on the Flying Trapeze,Comedy,1935,Movie not found on DBpedia by query title.
7006,67923,"Fast & Furious (Fast and the Furious 4, The)","Action, Crime, Drama, Thriller",2009,Movie not found on DBpedia by query title.
7007,67997,In the Loop,Comedy,2009,Movie not found on DBpedia by query title.
7008,68073,Pirate Radio,"Comedy, Drama",2009,Movie not found on DBpedia by query title.
7009,68135,17 Again,"Comedy, Drama",2009,Movie not found on DBpedia by query title.
7010,68157,Inglourious Basterds,"Action, Drama, War",2009,Movie not found on DBpedia by query title.
7011,68159,State of Play,"Crime, Drama, Thriller",2009,Movie not found on DBpedia by query title.
7012,68194,"Damned United, The",Drama,2009,Movie not found on DBpedia by query title.
7013,68205,Crank: High Voltage,"Action, Comedy, Crime",2009,Movie not found on DBpedia by query title.
7014,68237,Moon,"Drama, Mystery, Sci-Fi, Thriller",2009,"Moon is a 2009 British science fiction drama film co-written and directed by Duncan Jones. The film follows Sam Bell (Sam Rockwell), a man who experiences a personal crisis as he nears the end of a three-year solitary stint mining helium-3 on the far side of the Moon. It was the feature debut of director Duncan Jones. Kevin Spacey voices Sam's robot companion, GERTY. Moon premiered at the 2009 Sundance Film Festival and was released in selected cinemas in New York and Los Angeles on 12 June 2009. The release was expanded to additional theatres in the United States and Toronto on both 3 and 10 July and to the United Kingdom on 17 July. Moon was modestly budgeted and grossed just under $10 million worldwide but was well received by critics. Rockwell's performance found praise as did the film's scientific realism and plausibility. It won numerous film critic and film festival awards and was nominated for Outstanding British Film at the BAFTAs."
7015,68269,"Young Victoria, The","Drama, Romance",2009,Movie not found on DBpedia by query title.
7016,68319,X-Men Origins: Wolverine,"Action, Sci-Fi, Thriller",2009,Movie not found on DBpedia by query title.
7017,68347,Sin Nombre,"Crime, Drama, Thriller",2009,Movie not found on DBpedia by query title.
7018,68358,Star Trek,"Action, Adventure, Sci-Fi, IMAX",2009,Movie not found on DBpedia by query title.
7019,68444,"Great Buck Howard, The",Comedy,2008,Movie not found on DBpedia by query title.
7020,68480,Flatfoot on the Nile (Piedone d'Egitto),"Action, Comedy, Crime",1980,Movie not found on DBpedia by query title.
7021,68486,Red Cliff Part II (Chi Bi Xia: Jue Zhan Tian Xia),"Action, Drama, War",2009,Movie not found on DBpedia by query title.
7022,68522,Earth,Documentary,2007,"Earth (Ukrainian: Земля, translit. Zemlya) is a 1930 Soviet silent film by Ukrainian director Alexander Dovzhenko, concerning the process of collectivization and the hostility of Kulak landowners. It is Part 3 of Dovzhenko's ""Ukraine Trilogy"" (along with Zvenigora and Arsenal)."
7023,68536,Stanley Kubrick: A Life in Pictures,Documentary,2001,Movie not found on DBpedia by query title.
7024,68552,Crossing Over,Drama,2009,Movie not found on DBpedia by query title.
7025,68554,Angels & Demons,"Crime, Drama, Mystery, Thriller",2009,Movie not found on DBpedia by query title.
7026,68597,Scorpio,"Action, Drama, Thriller",1973,"Scorpio is a 1973 spy film directed by Michael Winner. It stars Burt Lancaster, Alain Delon and Paul Scofield."
7027,68600,Balls Out: Gary the Tennis Coach,Comedy,2009,Movie not found on DBpedia by query title.
7028,68650,Powder Blue,Drama,2009,Movie not found on DBpedia by query title.
7029,68659,Fanboys,"Adventure, Comedy, Drama",2009,"Fanboys is a 2009 comedy film directed by Kyle Newman and starring Sam Huntington, Chris Marquette, Dan Fogler, Jay Baruchel and Kristen Bell. It was released in the United States on February 6, 2009, and in Canada on April 3, 2009."
7030,68791,Terminator Salvation,"Action, Adventure, Sci-Fi, Thriller",2009,Movie not found on DBpedia by query title.
7031,68793,Night at the Museum: Battle of the Smithsonian,"Action, Comedy, IMAX",2009,Movie not found on DBpedia by query title.
7032,68835,Were the World Mine,"Adventure, Fantasy, Musical, Romance",2008,Movie not found on DBpedia by query title.
7033,68848,"Brothers Bloom, The","Adventure, Comedy, Crime, Romance",2008,Movie not found on DBpedia by query title.
7034,68872,Paisan (Paisà),"Drama, War",1946,Movie not found on DBpedia by query title.
7035,68886,I Do: How to Get Married and Stay Single (Prête-moi ta main),"Comedy, Romance",2006,Movie not found on DBpedia by query title.
7036,68932,"Soloist, The","Drama, Musical",2009,Movie not found on DBpedia by query title.
7037,68945,Neon Genesis Evangelion: Death & Rebirth (Shin seiki Evangelion Gekijô-ban: Shito shinsei),"Action, Animation, Mystery, Sci-Fi",1997,Movie not found on DBpedia by query title.
7038,68952,Drag Me to Hell,"Comedy, Horror",2009,Movie not found on DBpedia by query title.
7039,68954,Up,"Adventure, Animation, Children, Drama",2009,"Up is a 1984 American short film directed by Mike Hoover and Tim Huntley. It won an Academy Award in 1985 for Best Short Subject. The film depicts a man who sets an eagle free, then tries to find it in the wild on his hang glider."
7040,68959,Fullmetal Alchemist the Movie: Conqueror of Shamballa (Gekijô-ban hagane no renkinjutsushi: Shanbara wo yuku mono),"Action, Adventure, Animation, Drama",2005,Movie not found on DBpedia by query title.
7041,69069,Fired Up,Comedy,2009,Movie not found on DBpedia by query title.
7042,69118,In the Electric Mist,"Drama, Mystery",2009,Movie not found on DBpedia by query title.
7043,69122,"Hangover, The","Comedy, Crime",2009,Movie not found on DBpedia by query title.
7044,69131,Killshot,"Action, Crime, Drama, Thriller",2008,"Killshot is a 2008 American thriller film directed by John Madden and starring Diane Lane, Thomas Jane, Mickey Rourke and Joseph Gordon-Levitt. It is based on Elmore Leonard's 1989 novel of the same name. The story follows a couple who, despite being in a Witness Protection Program, are being chased and confronted by the criminal they outed."
7045,69134,Antichrist,"Drama, Fantasy",2009,"Antichrist is a 2009 Danish experimental horror film written and directed by Lars von Trier, starring Willem Dafoe and Charlotte Gainsbourg. It tells the story of a couple who, after the death of their child, retreat to a cabin in the woods where the man experiences strange visions and the woman manifests increasingly violent sexual behaviour and sadomasochism. The narrative is divided into a prologue, four chapters, and an epilogue. The film was primarily a Danish production but co-produced by companies from six different European countries. It was filmed in Germany and Sweden. After premiering at the 2009 Cannes Film Festival, where Gainsbourg won the festival's award for Best Actress, the film immediately caused controversy, with critics generally praising the film's artistic execution but strongly divided regarding its substantive merit. Other awards won by the film include the Robert Award for best Danish film, The Nordic Council Film Prize for best Nordic film and the European Film Award for best cinematography. The film is dedicated to the Soviet filmmaker Andrei Tarkovsky (1932–86). Antichrist is the first film in Trier's unofficially titled ""Depression Trilogy"". It was followed in 2011 by Melancholia and then by Nymphomaniac in 2013."
7046,69140,Sweeney Todd,"Crime, Drama, Horror, Thriller",2006,Movie not found on DBpedia by query title.
7047,69211,Boy Eats Girl,"Comedy, Horror",2005,Movie not found on DBpedia by query title.
7048,69224,Marius and Jeanette (Marius et Jeannette),"Comedy, Drama, Romance",1997,Movie not found on DBpedia by query title.
7049,69227,Ernest Rides Again,"Children, Comedy",1993,Movie not found on DBpedia by query title.
7050,69251,Special,"Drama, Fantasy",2006,"Special is a 2006 comedy-drama psychological thriller science fiction film satire written and directed by Hal Haberman and Jeremy Passmore. It was released in theatres in the UK on November 17, 2006 and on DVD in the UK on March 5, 2007. It was released in theatres in the US on November 21, 2008."
7051,69275,Dead Snow (Død snø),"Action, Adventure, Comedy, Horror",2009,Movie not found on DBpedia by query title.
7052,69278,Land of the Lost,"Action, Adventure, Comedy, Sci-Fi",2009,Movie not found on DBpedia by query title.
7053,69304,Imagine That,"Comedy, Drama, Fantasy",2009,Movie not found on DBpedia by query title.
7054,69306,"Taking of Pelham 1 2 3, The","Crime, Drama, Thriller",2009,Movie not found on DBpedia by query title.
7055,69394,"Stoning of Soraya M., The","Crime, Drama",2008,Movie not found on DBpedia by query title.
7056,69406,"Proposal, The","Comedy, Romance",2009,Movie not found on DBpedia by query title.
7057,69436,Year One,"Adventure, Comedy",2009,Movie not found on DBpedia by query title.
7058,69453,"Land That Time Forgot, The","Adventure, Sci-Fi",1975,Movie not found on DBpedia by query title.
7059,69469,Garfield's Pet Force,Animation,2009,Movie not found on DBpedia by query title.
7060,69481,"Hurt Locker, The","Action, Drama, Thriller, War",2008,Movie not found on DBpedia by query title.
7061,69495,Breakfast with Scot,"Drama, Romance",2007,Movie not found on DBpedia by query title.
7062,69516,"Limits of Control, The","Crime, Drama, Film-Noir",2009,Movie not found on DBpedia by query title.
7063,69524,Raiders of the Lost Ark: The Adaptation,"Action, Adventure, Thriller",1989,Movie not found on DBpedia by query title.
7064,69526,Transformers: Revenge of the Fallen,"Action, Adventure, Sci-Fi, IMAX",2009,Movie not found on DBpedia by query title.
7065,69529,Home,Documentary,2009,"Home is a 1915 British silent drama film directed by Maurice Elvey and starring Elisabeth Risdon, Fred Groves and A.V. Bramble. A poor girl discovers she is really a Duke's daughter, but eventually returns to her own family of fishermen."
7066,69604,Whatever Works,"Comedy, Romance",2009,Movie not found on DBpedia by query title.
7067,69606,Ghosts of Girlfriends Past,"Comedy, Fantasy, Romance",2009,Movie not found on DBpedia by query title.
7068,69640,Public Enemies,"Crime, Drama, Thriller",2009,Movie not found on DBpedia by query title.
7069,69644,Ice Age: Dawn of the Dinosaurs,"Action, Adventure, Animation, Children, Comedy, Romance",2009,Movie not found on DBpedia by query title.
7070,69654,Prison Break: The Final Break,"Action, Drama, Thriller",2009,Movie not found on DBpedia by query title.
7071,69685,Daria: Is It College Yet?,"Animation, Comedy",2002,Movie not found on DBpedia by query title.
7072,69712,My Sister's Keeper,Drama,2009,Movie not found on DBpedia by query title.
7073,69720,Hood of Horror,"Comedy, Drama, Horror",2006,Movie not found on DBpedia by query title.
7074,69746,Watchmen: Tales of the Black Freighter,"Action, Adventure, Animation, Horror",2009,Movie not found on DBpedia by query title.
7075,69757,(500) Days of Summer,"Comedy, Drama, Romance",2009,Movie not found on DBpedia by query title.
7076,69784,Brüno (Bruno),Comedy,2009,Movie not found on DBpedia by query title.
7077,69805,"Librarian, The: The Curse of the Judas Chalice","Action, Adventure, Fantasy",2008,Movie not found on DBpedia by query title.
7078,69844,Harry Potter and the Half-Blood Prince,"Adventure, Fantasy, Mystery, Romance, IMAX",2009,Movie not found on DBpedia by query title.
7079,69849,Roots,"Drama, War",1977,Roots (Spanish: Raíces) is a 1955 Mexican drama film directed by Benito Alazraki. It was entered into the 1955 Cannes Film Festival.
7080,69860,Eichmann,"Drama, War",2007,"Eichmann is a biographical film detailing the interrogation of Adolf Eichmann. Directed by Robert Young, the film stars Thomas Kretschmann as Eichmann and Troy Garity as Eichmann's Israeli interrogator, Avner Less. It was first released in Brazil in September 2007, and was released in the United States in October 2010."
7081,69904,Open Water 2: Adrift,"Drama, Thriller",2006,Movie not found on DBpedia by query title.
7082,69951,"Imaginarium of Doctor Parnassus, The","Drama, Fantasy",2009,Movie not found on DBpedia by query title.
7083,69953,9to5: Days in Porn (a.k.a. 9 to 5: Days in Porn),Documentary,2008,Movie not found on DBpedia by query title.
7084,69988,Humpday,Comedy,2009,"Humpday is a 2009 American comedy film starring Mark Duplass, Joshua Leonard, and Alycia Delmore; and directed, produced, and written by Lynn Shelton. It premiered at the 2009 Sundance film festival. International distribution rights have been purchased by Magnolia Pictures for a mid-six figure sum. The film opened in New York City on a limited released on July 10, 2009. Much of the dialogue for the film was improvised."
7085,70015,Polytechnique,"Crime, Drama",2009,"Polytechnique is a 2009 Canadian film directed by Denis Villeneuve and written by Villeneuve and Jacques Davidts. Set in Montreal, Quebec and based on the École Polytechnique massacre (also known as the ""Montreal Massacre""), the film documents the events of December 6, 1989, through the eyes of two students who witness a gunman murder fourteen young women. The film was released on February 6, 2009, in Quebec and on March 20, 2009, in Toronto, Vancouver and Calgary. Its release has sparked controversy in Quebec and across Canada for its depiction of real life events involving the murder of unarmed students. The film was screened at the Directors' Fortnight on May 17, 2009."
7086,70159,Orphan,"Drama, Horror, Mystery, Thriller",2009,"Orphan is a 2009 American psychological horror film directed by Jaume Collet-Serra from a screenplay by David Leslie Johnson. The film stars Vera Farmiga, Peter Sarsgaard, and Isabelle Fuhrman. The plot centers on a couple who, after the death of their unborn child, adopt a mysterious 9-year-old girl. Orphan was produced by Joel Silver and Susan Downey of Dark Castle Entertainment, and Leonardo DiCaprio and Jennifer Davisson Killoran of Appian Way Productions. The film was released theatrically in the United States on July 24, 2009 by Warner Bros. Pictures. Some critics compared Fuhrman's performance as Esther to that of Linda Blair in The Exorcist and Patty McCormack in The Bad Seed."
7087,70183,"Ugly Truth, The","Comedy, Drama, Romance",2009,Movie not found on DBpedia by query title.
7088,70206,"Collector, The","Crime, Horror, Thriller",2009,Movie not found on DBpedia by query title.
7089,70208,"Perfect Getaway, A","Horror, Thriller",2009,Movie not found on DBpedia by query title.
7090,70286,District 9,"Mystery, Sci-Fi, Thriller",2009,Movie not found on DBpedia by query title.
7091,70293,Julie & Julia,"Comedy, Drama, Romance",2009,Movie not found on DBpedia by query title.
7092,70301,Obsessed,"Crime, Drama, Thriller",2009,"Obsessed (also known as Anna Obsessed and Blue Obsessions) is a 1977 pornographic film directed by Martin & Martin, and written by Piastro Cruiso."
7093,70305,Race to Witch Mountain,"Adventure, Children, Fantasy, Sci-Fi, Thriller",2009,Movie not found on DBpedia by query title.
7094,70334,Hannah Montana: The Movie,"Comedy, Drama, Musical, Romance",2009,Movie not found on DBpedia by query title.
7095,70336,G.I. Joe: The Rise of Cobra,"Action, Adventure, Sci-Fi, Thriller",2009,Movie not found on DBpedia by query title.
7096,70361,12 Rounds,"Action, Thriller",2009,Movie not found on DBpedia by query title.
7097,70451,Max Manus,"Action, Drama, War",2008,Movie not found on DBpedia by query title.
7098,70492,Winds of the Wasteland,Western,1936,Movie not found on DBpedia by query title.
7099,70521,Lost in Austen,"Drama, Fantasy, Romance, Sci-Fi",2008,Movie not found on DBpedia by query title.
7100,70533,Evangelion: 1.0 You Are (Not) Alone (Evangerion shin gekijôban: Jo),"Action, Animation, Sci-Fi",2007,Movie not found on DBpedia by query title.
7101,70545,"Deal, The",Comedy,2008,Movie not found on DBpedia by query title.
7102,70565,"Goods: Live Hard, Sell Hard, The",Comedy,2009,Movie not found on DBpedia by query title.
7103,70599,"Time Traveler's Wife, The","Drama, Romance, Sci-Fi",2009,Movie not found on DBpedia by query title.
7104,70637,I Can't Think Straight,"Drama, Romance",2007,Movie not found on DBpedia by query title.
7105,70641,Miss March,Comedy,2009,Movie not found on DBpedia by query title.
7106,70663,"I Love You, Beth Cooper","Comedy, Romance",2009,Movie not found on DBpedia by query title.
7107,70687,Paper Heart,"Comedy, Documentary, Drama, Romance",2009,Movie not found on DBpedia by query title.
7108,70697,G-Force,"Action, Adventure, Children, Fantasy",2009,"G-Force is a 2009 American family adventure film produced by Walt Disney Pictures and Jerry Bruckheimer Films. Written by Cormac Wibberley and Marianne Wibberley and directed by Hoyt Yeatman, the film is the directorial debut of Hoyt Yeatman, whose earlier work includes contributions in the area of visual effects. It was released in the United States on July 24, 2009. G-Force is based on a story also by Hoyt Yeatman. The film was shown in competing 3-D technologies like Dolby 3D. This is also Jerry Bruckheimer's first 3-D film. The movie stars Zach Galifianakis, Bill Nighy, and Will Arnett and it features the voices of Sam Rockwell, Tracy Morgan, Penélope Cruz, Nicolas Cage, Steve Buscemi, and Jon Favreau. The film received generally negative reviews, with critics praising its action, but criticizing its plot and character development and it earned $292.8 million on a $150 million budget."
7109,70703,Christopher Columbus: The Discovery,Adventure,1992,Movie not found on DBpedia by query title.
7110,70708,Tetro,"Drama, Mystery",2009,"Tetro is a 2009 American-Argentine drama film written, directed and produced by Francis Ford Coppola and starring Vincent Gallo, Alden Ehrenreich and Maribel Verdú. Filming took place in 2008 in Buenos Aires, Patagonia, and Spain. Tetro received a limited release in the United States on June 11, 2009."
7111,70728,Bronson,"Action, Comedy, Drama, Thriller",2009,"Bronson is a 2008 British fictionalized biographical crime film co-written and directed by Nicolas Winding Refn and starring Tom Hardy. The film follows the life of notorious prisoner Michael Gordon Peterson, who was renamed Charles Bronson by his fight promoter. Born into a respectable middle-class family, Peterson would nevertheless become one of the United Kingdom's most dangerous criminals, and is known for having spent almost his entire adult life in solitary confinement. Bronson is narrated with humour, blurring the line between comedy and horror."
7112,70862,It Might Get Loud,Documentary,2008,Movie not found on DBpedia by query title.
7113,70932,My Life in Ruins,Comedy,2009,Movie not found on DBpedia by query title.
7114,70946,Troll 2,"Fantasy, Horror",1990,Movie not found on DBpedia by query title.
7115,70984,Taking Woodstock,Comedy,2009,Movie not found on DBpedia by query title.
7116,70990,If These Walls Could Talk,Drama,1996,Movie not found on DBpedia by query title.
7117,70994,Halloween II,"Horror, Thriller",2009,Movie not found on DBpedia by query title.
7118,71033,"Secret in Their Eyes, The (El secreto de sus ojos)","Crime, Drama, Mystery, Romance, Thriller",2009,Movie not found on DBpedia by query title.
7119,71057,9,"Adventure, Animation, Sci-Fi",2009,"9 is a 2005 computer animated short film created by Shane Acker as a student project at the UCLA Animation Workshop. Tim Burton saw the film and was so impressed by its artistic vision that he went on to produce a feature-length adaptation also titled 9, directed by Acker and distributed by Focus Features. The film was presented at the Indianapolis International Film Festival. It was nominated for an Academy Award for best animated short film, but lost to The Moon and the Son: An Imagined Conversation, although it did win a Student Academy Award for Best Animation."
7120,71106,Frequently Asked Questions About Time Travel,"Comedy, Sci-Fi",2009,Movie not found on DBpedia by query title.
7121,71108,"White Ribbon, The (Das weiße Band)","Drama, Mystery",2009,Movie not found on DBpedia by query title.
7122,71129,Green Lantern: First Flight,"Action, Adventure, Animation, Fantasy, Sci-Fi",2009,Movie not found on DBpedia by query title.
7123,71131,"Most Hated Family in America, The",Documentary,2007,Movie not found on DBpedia by query title.
7124,71135,Pandorum,"Horror, Sci-Fi, Thriller",2009,"(For the game based on the film, see Pandorum (video game).) Pandorum is a German-British 2009 science fiction horror film, with elements of Lovecraftian horror, and survival adventure. The film was directed by Christian Alvart and produced by Robert Kulzer, Jeremy Bolt and Paul W.S. Anderson. Travis Milloy wrote the screenplay from a story by Milloy and Alvart. It stars Dennis Quaid and Ben Foster. Filming began in Berlin in August 2008. Pandorum was released on 25 September 2009 in the United States, and on 2 October 2009 in the UK. The film's title is a nickname of a fictional psychosis called ""Orbital Dysfunctional Syndrome"" (ODS for short) caused by deep space and triggered by emotional stress leading to severe paranoia, delirium, and nosebleeding. The film received mixed to negative reviews, but has gained a cult following over time."
7125,71147,Death of a Cyclist (Muerte de un ciclista),Drama,1955,Movie not found on DBpedia by query title.
7126,71156,"Men Who Stare at Goats, The","Action, Comedy, Drama",2009,Movie not found on DBpedia by query title.
7127,71160,"Hunt For Gollum, The","Action, Adventure, Fantasy",2009,Movie not found on DBpedia by query title.
7128,71205,Jennifer's Body,"Comedy, Horror, Sci-Fi, Thriller",2009,Movie not found on DBpedia by query title.
7129,71211,"Informant!, The","Comedy, Crime, Drama, Thriller",2009,Movie not found on DBpedia by query title.
7130,71248,Extract,Comedy,2009,"Extract is a 2009 American comedy film written and directed by Mike Judge, and starring an ensemble cast featuring Jason Bateman, Mila Kunis, Kristen Wiig, and Ben Affleck, with J. K. Simmons, Clifton Collins, Jr., and Dustin Milligan. Said to be Judge's companion piece to his cult-classic Office Space, the film received mixed to positive reviews from critics and was a minor commercial success, grossing a little over $10 million worldwide from an $8 million budget."
7131,71252,"Final Destination, The (Final Destination 4) (Final Destination in 3-D, The)","Horror, Thriller",2009,Movie not found on DBpedia by query title.
7132,71254,Gamer,"Action, Sci-Fi, Thriller",2009,"Gamer is a 2009 American science fiction action thriller film written and directed by Mark Neveldine and Brian Taylor. The film stars Gerard Butler as a participant in an online game in which participants can control human beings as players, and Logan Lerman as the player who controls him. Alongside Butler and Lerman, it also stars Michael C. Hall, Ludacris, Amber Valletta, Terry Crews, Alison Lohman, John Leguizamo and Zoe Bell. Gamer was released in North America on September 4, 2009, received generally negative reviews from critics, who found the plot, direction and script disappointing and refuted but highly praised its cast performances, effects as well as its action sequences but although the critics, it received mixed to positive reception by audiences and was a box office bomb with grossing only $40.8 million worldwide against production budget of $50 million."
7133,71264,Cloudy with a Chance of Meatballs,"Animation, Children, Fantasy, IMAX",2009,Movie not found on DBpedia by query title.
7134,71268,Tyler Perry's I Can Do Bad All by Myself,"Comedy, Drama",2009,Movie not found on DBpedia by query title.
7135,71282,"Food, Inc.",Documentary,2008,Movie not found on DBpedia by query title.
7136,71302,Attack of the 50 Foot Woman,"Comedy, Sci-Fi",1958,Movie not found on DBpedia by query title.
7137,71304,Thirst (Bakjwi),"Drama, Horror",2009,Movie not found on DBpedia by query title.
7138,71327,Bright Star,"Drama, Romance",2009,Movie not found on DBpedia by query title.
7139,71341,Blood Creek (a.k.a. Town Creek),Horror,2009,Movie not found on DBpedia by query title.
7140,71379,Paranormal Activity,"Horror, Thriller",2009,Movie not found on DBpedia by query title.
7141,71429,World's Greatest Dad,"Comedy, Drama",2009,Movie not found on DBpedia by query title.
7142,71438,Still Walking (Aruitemo aruitemo),Drama,2008,Movie not found on DBpedia by query title.
