,movieId,title,genres,year,abstract
6000,37477,"Man, The","Action, Comedy, Crime",2005,Movie not found on DBpedia by query title.
6001,37495,Survive Style 5+,"Fantasy, Mystery, Romance, Thriller",2004,Movie not found on DBpedia by query title.
6002,37545,Woyzeck,Drama,1979,"Woyzeck [ˈvɔʏtsɛk] is a 1979 German drama film written, produced and directed by Werner Herzog and starring Klaus Kinski and Eva Mattes. It is an adaptation of the unfinished play Woyzeck by German dramatist Georg Büchner."
6003,37720,"Exorcism of Emily Rose, The","Crime, Drama, Horror, Thriller",2005,Movie not found on DBpedia by query title.
6004,37727,Flightplan,"Action, Drama, Thriller",2005,"Flightplan is a 2005 German-American mystery-thriller film directed by Robert Schwentke, written by Peter A. Dowling and Billy Ray, and starring Jodie Foster, Peter Sarsgaard, Erika Christensen, Kate Beahan, Greta Scacchi, and Sean Bean. The film, distributed by Touchstone Pictures, was released theatrically in the United States on September 23, 2005. The basic premise of the plot (albeit with a very different denouement) is quite similar to a 1955 episode of Alfred Hitchcock Presents entitled ""Into Thin Air"", as well as Hitchcock's 1938 film The Lady Vanishes."
6005,37729,Corpse Bride,"Animation, Comedy, Fantasy, Musical, Romance",2005,Movie not found on DBpedia by query title.
6006,37731,Green Street Hooligans (a.k.a. Hooligans),"Crime, Drama",2005,Movie not found on DBpedia by query title.
6007,37733,"History of Violence, A","Action, Crime, Drama, Thriller",2005,Movie not found on DBpedia by query title.
6008,37736,Oliver Twist,Drama,2005,Movie not found on DBpedia by query title.
6009,37739,"Greatest Game Ever Played, The",Drama,2005,Movie not found on DBpedia by query title.
6010,37741,Capote,"Crime, Drama",2005,"Capote is a 2005 biographical film about Truman Capote, following the events during the writing of Capote's non-fiction book In Cold Blood. Philip Seymour Hoffman won several awards, including the Academy Award for Best Actor, for his critically acclaimed portrayal of the title character. The film was based on Gerald Clarke's biography Capote and was directed by Bennett Miller. It was filmed mostly in Manitoba in the autumn of 2004. It was released September 30, 2005, to coincide with Truman Capote's birthday."
6011,37830,Final Fantasy VII: Advent Children,"Action, Adventure, Animation, Fantasy, Sci-Fi",2004,Movie not found on DBpedia by query title.
6012,37844,Roll Bounce,"Comedy, Drama, Romance",2005,Movie not found on DBpedia by query title.
6013,37853,Into the Blue,"Action, Adventure, Crime, Thriller",2005,Movie not found on DBpedia by query title.
6014,37857,MirrorMask,"Adventure, Children, Drama, Fantasy",2005,Movie not found on DBpedia by query title.
6015,38038,Wallace & Gromit in The Curse of the Were-Rabbit,"Adventure, Animation, Children, Comedy",2005,Movie not found on DBpedia by query title.
6016,38061,Kiss Kiss Bang Bang,"Comedy, Crime, Mystery, Thriller",2005,Movie not found on DBpedia by query title.
6017,38095,"Bittersweet Life, A (Dalkomhan insaeng)","Action, Crime, Drama",2005,Movie not found on DBpedia by query title.
6018,38159,"Short Film About Love, A (Krótki film o milosci)","Drama, Romance",1988,Movie not found on DBpedia by query title.
6019,38164,"All This, and Heaven Too","Drama, Romance",1940,Movie not found on DBpedia by query title.
6020,38198,Darwin's Nightmare,Documentary,2004,Movie not found on DBpedia by query title.
6021,38294,Beowulf & Grendel,"Action, Adventure, Drama, Fantasy",2005,Movie not found on DBpedia by query title.
6022,38304,No Direction Home: Bob Dylan,Documentary,2005,Movie not found on DBpedia by query title.
6023,38388,Goal! The Dream Begins (Goal!),Drama,2005,Movie not found on DBpedia by query title.
6024,38583,"Wraith, The","Action, Horror, Sci-Fi, Thriller",1986,Movie not found on DBpedia by query title.
6025,38798,In Her Shoes,"Comedy, Drama",2005,Movie not found on DBpedia by query title.
6026,38886,"Squid and the Whale, The","Comedy, Drama",2005,Movie not found on DBpedia by query title.
6027,38992,Two for the Money,Drama,2005,Movie not found on DBpedia by query title.
6028,39183,Brokeback Mountain,"Drama, Romance",2005,Movie not found on DBpedia by query title.
6029,39231,Elizabethtown,"Comedy, Drama, Romance",2005,"Elizabethtown is a 2005 American romantic tragicomedy film written and directed by Cameron Crowe, and starring Orlando Bloom and Kirsten Dunst. Alec Baldwin has a small role as a CEO of an athletic shoe company and Susan Sarandon appears as a grieving widow. The movie's title comes from its primary location, Elizabethtown, Kentucky. It is unrelated to Elizabethtown, Pennsylvania or Elizabethtown College."
6030,39234,North Country,Drama,2005,Movie not found on DBpedia by query title.
6031,39292,"Good Night, and Good Luck.","Crime, Drama",2005,Movie not found on DBpedia by query title.
6032,39307,Dreamer: Inspired by a True Story,"Children, Drama",2005,Movie not found on DBpedia by query title.
6033,39381,"Proposition, The","Crime, Drama, Western",2005,Movie not found on DBpedia by query title.
6034,39400,"Fog, The","Action, Horror, Mystery, Thriller",2005,Movie not found on DBpedia by query title.
6035,39414,Shopgirl,"Comedy, Drama, Romance",2005,"Shopgirl is a 2005 American romantic drama film directed by Anand Tucker and starring Steve Martin, Claire Danes, and Jason Schwartzman. The screenplay by Steve Martin is based on his 2000 novella of the same name. The film is about a complex love triangle between a bored salesgirl, a wealthy businessman, and an aimless young man. Produced by Ashok Amritraj, Jon Jashni, and Steve Martin for Touchstone Pictures and Hyde Park Entertainment, and distributed in the United States by Buena Vista Pictures, Shopgirl was released on October 21, 2005 and received generally positive reviews from film critics. The film went on to earn $11,112,077 and was nominated for four Satellite Awards, including Best Picture and Best Adapted Screenplay."
6036,39427,Stay,Thriller,2005,"Stay is a 2005 American psychological thriller film directed by Marc Forster and written by David Benioff. It stars Ewan McGregor, Naomi Watts, Ryan Gosling and Bob Hoskins, with production by Regency and distribution by 20th Century Fox. The film represents intense relationships centering on reality, death, love and the afterlife."
6037,39435,"Legend of Zorro, The","Action, Adventure, Drama, Western",2005,Movie not found on DBpedia by query title.
6038,39444,"Weather Man, The","Comedy, Drama",2005,Movie not found on DBpedia by query title.
6039,39446,Saw II,"Horror, Thriller",2005,Movie not found on DBpedia by query title.
6040,39449,Prime,"Comedy, Drama, Romance",2005,"Prime is a 2005 American romantic comedy film starring Uma Thurman, Meryl Streep and Bryan Greenberg. It was written and directed by Ben Younger. The film grossed $67,937,503 worldwide."
6041,39516,Don't Move (Non ti muovere),Drama,2004,Movie not found on DBpedia by query title.
6042,39715,American Pie Presents: Band Camp (American Pie 4: Band Camp),Comedy,2005,Movie not found on DBpedia by query title.
6043,39801,"Great Yokai War, The (Yôkai daisensô)","Adventure, Comedy, Fantasy, Horror",2005,Movie not found on DBpedia by query title.
6044,39869,Manderlay,Drama,2005,"For the fictional estate, see Manderley; for the Burmese city, see Mandalay. Manderlay is a 2005 Danish drama film written and directed by Lars von Trier and the second part of von Trier's projected USA – Land of Opportunities trilogy. It stars Bryce Dallas Howard, who replaces Nicole Kidman in the role of Grace Mulligan. The film co-stars Willem Dafoe, replacing James Caan. Lauren Bacall and Chloë Sevigny return portraying different characters from those in Dogville.Only John Hurt, Udo Kier and Jean-Marc Barr reprise their roles. The staging is very similar to Dogville. The film was shot on a sparsely dressed sound stage. As in the case of Dogville, Manderlay's action is confined to a small geographic area, in this case a plantation."
6045,40148,Revolver,"Crime, Drama, Thriller",2005,"Revolver Rani is a 2014 Indian crime drama film written and directed by Sai Kabir. The film is presented by Wave Cinemas. It features Kangana Ranaut and Vir Das in lead roles and Piyush Mishra, Zakir Hussain and Pankaj Saraswat in supporting roles. The film is a satirical and unusual love story set against the backdrop of politics and released on 25 April 2014."
6046,40278,Jarhead,"Action, Drama, War",2005,"Jarhead is a 2005 American biographical war drama film based on U.S. Marine Anthony Swofford's 2003 memoir of the same name, directed by Sam Mendes, starring Jake Gyllenhaal as Swofford with Jamie Foxx, Peter Sarsgaard and Chris Cooper. The title comes from the slang term used to refer to United States Marines."
6047,40339,Chicken Little,"Action, Adventure, Animation, Children, Comedy, Sci-Fi",2005,Movie not found on DBpedia by query title.
6048,40412,Dead Man's Shoes,"Crime, Thriller",2004,Movie not found on DBpedia by query title.
6049,40414,Joyeux Noël (Merry Christmas),"Drama, War",2005,Movie not found on DBpedia by query title.
6050,40478,Night of the Lepus,"Horror, Sci-Fi, Thriller",1972,Movie not found on DBpedia by query title.
6051,40491,"Match Factory Girl, The (Tulitikkutehtaan tyttö)","Comedy, Drama",1990,Movie not found on DBpedia by query title.
6052,40578,Sword of the Beast (Kedamono no ken),"Action, Drama",1965,Movie not found on DBpedia by query title.
6053,40581,Just Friends,"Comedy, Romance",2005,Movie not found on DBpedia by query title.
6054,40583,Syriana,"Drama, Thriller",2005,"Syriana is a 2005 geopolitical thriller film written and directed by Stephen Gaghan, and executive produced by George Clooney, who also stars in the film with an ensemble cast. Gaghan's screenplay is loosely adapted from Robert Baer's memoir See No Evil. The film focuses on petroleum politics and the global influence of the oil industry, whose political, economic, legal, and social effects are experienced by a Central Intelligence Agency operative (George Clooney), an energy analyst (Matt Damon), a Washington, D.C. attorney (Jeffrey Wright), and a young unemployed Pakistani migrant worker (Mazhar Munir) in an Arab state in the Persian Gulf. The film also features an extensive supporting cast including Amanda Peet, Tim Blake Nelson, Mark Strong, Alexander Siddig, Amr Waked, and Academy Award winners Christopher Plummer, Chris Cooper and William Hurt. As with Gaghan's screenplay for Traffic, Syriana uses multiple, parallel storylines, jumping between locations in Iran, Texas, Washington, D.C., Switzerland, Spain and Lebanon. Clooney won the Academy Award for Best Supporting Actor for his role as Bob Barnes, and Gaghan's script was nominated by the Academy for Best Original Screenplay. As of April 20, 2006, the film had grossed a total of $50.82 million at the U.S. box office and $42.9 million overseas, for a total of $93.73 million."
6055,40597,One-Way Ticket to Mombasa (Menolippu Mombasaan),"Comedy, Drama",2002,Movie not found on DBpedia by query title.
6056,40614,Derailed,"Drama, Thriller",2005,"Derailed is a 2002 American action film directed by Bob Misiorowski, and starring Jean-Claude Van Damme, Tomas Arana, Laura Harring and Jean-Claude Van Damme's real life son Kristopher Van Varenberg. The film was released on direct-to-DVD in the United States on October 15, 2002."
6057,40617,Creep,"Horror, Thriller",2004,Creep is a 2004 British-German horror film written and directed by Christopher Smith. The film follows a woman locked in the London Underground overnight who finds herself being stalked by a hideously deformed killer living in the sewers below. The film was first shown at the Frankfurt Fantasy Filmfest in Germany on 10 August 2004.
6058,40629,Pride & Prejudice,"Drama, Romance",2005,Movie not found on DBpedia by query title.
6059,40697,Ba,Sci-Fi,lon ,Movie not found on DBpedia by query title.
6060,40723,Wolf Creek,"Crime, Horror, Thriller",2005,Movie not found on DBpedia by query title.
6061,40732,"Descent, The","Adventure, Drama, Horror, Thriller",2005,Movie not found on DBpedia by query title.
6062,40815,Harry Potter and the Goblet of Fire,"Adventure, Fantasy, Thriller, IMAX",2005,Movie not found on DBpedia by query title.
6063,40819,Walk the Line,"Drama, Musical, Romance",2005,Movie not found on DBpedia by query title.
6064,40826,Rent,"Drama, Musical, Romance",2005,"Rent is a 2005 American musical drama film directed by Chris Columbus. It is an adaptation of the Broadway musical of the same name, in turn based on Giacomo Puccini's opera La bohème. The film depicts the lives of several Bohemians and their struggles with sexuality, drugs, paying their rent, and life under the shadow of AIDS. It takes place in the East Village of New York City from 1989 to 1990. The film features six of the original Broadway cast members reprising their roles."
6065,40851,Zathura,"Action, Adventure, Children, Fantasy",2005,"Zathura: A Space Adventure (or just Zathura) is a 2005 American science fantasy adventure film directed by Jon Favreau, and is loosely based on the illustrated book Zathura by Chris Van Allsburg, author of Jumanji. The film stars Josh Hutcherson, Jonah Bobo, Dax Shepard, Kristen Stewart, and Tim Robbins. The film was shot in Los Angeles and Culver City, California and was released on November 11, 2005 by Columbia Pictures. Unlike the book, the film contains no Jumanji material and does not mention any Jumanji events. The film was however marketed as a spiritual sequel with varying statements of the tagline, ""A new adventure from the world of Jumanji"". Despite positive reviews from critics, Zathura was a box office disappointment."
6066,40870,C.R.A.Z.Y.,Drama,2005,"C.R.A.Z.Y. is a 2005 French-language Canadian film from Quebec. The film was directed and co-written (with François Boulay) by Jean-Marc Vallée. It tells the story of Zac, a young gay man dealing with homophobia while growing up with four brothers and a conservative father in Quebec during the 1960s and 1970s."
6067,40946,Sarah Silverman: Jesus Is Magic,"Comedy, Musical",2005,Movie not found on DBpedia by query title.
6068,40955,Breakfast on Pluto,"Comedy, Drama",2005,Movie not found on DBpedia by query title.
6069,40959,"Ice Harvest, The","Action, Comedy, Crime, Thriller",2005,Movie not found on DBpedia by query title.
6070,40962,"Yours, Mine and Ours","Comedy, Romance",2005,Movie not found on DBpedia by query title.
6071,40966,"Libertine, The",Drama,2004,Movie not found on DBpedia by query title.
6072,41014,"Bird with the Crystal Plumage, The (Uccello dalle piume di cristallo, L')","Crime, Horror, Mystery, Thriller",1970,Movie not found on DBpedia by query title.
6073,41285,Match Point,"Crime, Drama, Romance",2005,Movie not found on DBpedia by query title.
6074,41527,Paradise Now,"Crime, Drama, Thriller, War",2005,Movie not found on DBpedia by query title.
6075,41566,"Chronicles of Narnia: The Lion, the Witch and the Wardrobe, The","Adventure, Children, Fantasy",2005,Movie not found on DBpedia by query title.
6076,41569,King Kong,"Action, Adventure, Drama, Fantasy, Thriller",2005,Movie not found on DBpedia by query title.
6077,41571,Memoirs of a Geisha,"Drama, Romance",2005,Movie not found on DBpedia by query title.
6078,41573,"Family Stone, The","Comedy, Drama, Romance",2005,Movie not found on DBpedia by query title.
6079,41617,Havoc,"Crime, Drama, Romance",2005,Havoc (German: Das Unheil) is a 1972 West German drama film directed by Peter Fleischmann. It was entered into the 1972 Cannes Film Festival.
6080,41627,Samurai Rebellion (Jôi-uchi: Hairyô tsuma shimatsu),"Action, Drama",1967,Movie not found on DBpedia by query title.
6081,41712,"Room for Romeo Brass, A","Comedy, Drama",1999,Movie not found on DBpedia by query title.
6082,41716,"Matador, The","Comedy, Drama, Thriller",2005,Movie not found on DBpedia by query title.
6083,41724,Wal-Mart: The High Cost of Low Price,Documentary,2005,Movie not found on DBpedia by query title.
6084,41769,Mozart and the Whale,"Comedy, Drama, Romance",2005,Movie not found on DBpedia by query title.
6085,41828,Don't Look Now: We're Being Shot At (La grande vadrouille),"Comedy, War",1966,Movie not found on DBpedia by query title.
6086,41863,"Three Burials of Melquiades Estrada, The","Adventure, Crime, Drama",2006,Movie not found on DBpedia by query title.
6087,41997,Munich,"Action, Crime, Drama, Thriller",2005,"Munich is a 2005 American-Canadian historical drama and political thriller film based on Operation Wrath of God, the Israeli government's secret retaliation against the Palestine Liberation Organization after the Munich massacre at the 1972 Summer Olympics. The film was produced and directed by Steven Spielberg and written by Tony Kushner and Eric Roth. Based on the book Vengeance about Yuval Aviv, who states he was a Mossad agent, Munich follows a squad of assassins as they track down and kill alleged members of the group Black September, which had kidnapped and murdered eleven Israeli athletes. Shot in Malta, Budapest, Paris and New York City, Munich was a critical success but is also one of Spielberg's lowest-grossing films. It garnered positive reviews and five Academy Awards nominations: Best Picture, Best Director (Spielberg), Best Adapted Screenplay (Kushner and Roth), Best Film Editing (Michael Kahn) and Best Original Score (John Williams). Its worldwide box office gross was $130,358,911."
6088,42002,"Producers, The","Comedy, Musical",2005,Movie not found on DBpedia by query title.
6089,42004,Transamerica,"Adventure, Comedy, Drama",2005,"Transamerica is a 2005 American comedy-drama film written and directed by Duncan Tucker, and starring Felicity Huffman and Kevin Zegers. Produced by IFC Films and The Weinstein Company, the film premiered at the Berlin International Film Festival on February 14, 2005 and was released theatrically in the United States on December 2, 2005. The screenplay, inspired in part by conversations between Tucker and his then roommate Katherine Connella, tells the story of Bree, a transgender woman (Huffman), who goes on a road trip with her long-lost son Toby (Zegers). One of the major themes is the personal journey toward self-discovery, according to interviews with the director and actors. The film is marked by an Academy Award–nominated and Golden Globe–winning performance by Huffman, who is also known for her performance in Desperate Housewives."
6090,42007,Rumor Has It...,"Comedy, Drama, Romance",2005,Movie not found on DBpedia by query title.
6091,42009,Cheaper by the Dozen 2,"Adventure, Comedy",2005,Movie not found on DBpedia by query title.
6092,42011,Fun with Dick and Jane,"Comedy, Crime",2005,Movie not found on DBpedia by query title.
6093,42013,"Ringer, The",Comedy,2005,Movie not found on DBpedia by query title.
6094,42015,Casanova,"Action, Adventure, Comedy, Drama, Romance",2005,Casanova is a 1918 Hungarian film directed by Alfréd Deésy and featuring Béla Lugosi.
6095,42018,Mrs. Henderson Presents,"Comedy, Drama",2005,Movie not found on DBpedia by query title.
6096,42176,"Ear, The (Ucho)","Drama, Thriller",1970,Movie not found on DBpedia by query title.
6097,42191,Luxo Jr.,"Animation, Children",1986,Movie not found on DBpedia by query title.
6098,42285,"Dentist, The","Horror, Thriller",1996,Movie not found on DBpedia by query title.
6099,42418,"New World, The","Adventure, Drama, Romance",2005,Movie not found on DBpedia by query title.
6100,42422,Voices of a Distant Star (Hoshi no koe),"Animation, Drama, Romance, Sci-Fi",2003,Movie not found on DBpedia by query title.
6101,42556,7 Faces of Dr. Lao,"Fantasy, Mystery, Western",1964,Movie not found on DBpedia by query title.
6102,42559,Samurai Assassin (Samurai),"Action, Adventure, Drama",1965,Movie not found on DBpedia by query title.
6103,42602,"Boys of Baraka, The",Documentary,2005,Movie not found on DBpedia by query title.
6104,42632,Lady Vengeance (Sympathy for Lady Vengeance) (Chinjeolhan geumjassi),"Crime, Drama, Mystery, Thriller",2005,Movie not found on DBpedia by query title.
6105,42638,Grand Theft Parsons,"Comedy, Drama",2003,Movie not found on DBpedia by query title.
6106,42718,District 13 (Banlieue 13),"Action, Crime, Sci-Fi",2004,Movie not found on DBpedia by query title.
6107,42723,Hostel,Horror,2005,"Hostel is a 2011 Bollywood movie by Manish Gupta. The film explores the psychology of ragging (hazing/initiation) and its disastrous effects on a student’s psyche. It was directed by writer-director Manish Gupta who scripted Sarkar (2005) and directed The Stoneman Murders (2009). The film starring Vatsal Sheth, Tulip Joshi and Mukesh Tiwari was released worldwide on 21 January 2011."
6108,42725,Grandma's Boy,Comedy,2006,Movie not found on DBpedia by query title.
6109,42728,Tristan & Isolde,"Drama, Romance",2006,Movie not found on DBpedia by query title.
6110,42730,Glory Road,Drama,2006,Movie not found on DBpedia by query title.
6111,42732,Last Holiday,Comedy,2006,Movie not found on DBpedia by query title.
6112,42734,Hoodwinked!,"Animation, Children, Comedy",2005,"Hoodwinked! (alternatively styled Hoodwinked) is a 2005 American computer-animated family comedy film. It retells the folktale Little Red Riding Hood as a police investigation, using flashbacks to show multiple characters' points of view. It was produced independently by Blue Yonder Films with Kanbar Entertainment, directed and written by Cory Edwards, Todd Edwards, and Tony Leech, and produced by Katie Hooten, Maurice Kanbar, David K. Lovegren, Sue Bea Montgomery, and Preston Stutzman. The film was released by The Weinstein Company in Los Angeles, California, on December 16, 2005 for a one-week engagement before expanding nationwide on January 13, 2006. The cast features Anne Hathaway, Glenn Close, Jim Belushi, Patrick Warburton, Anthony Anderson, David Ogden Stiers, Xzibit, Chazz Palminteri and Andy Dick. Hoodwinked! was among the earliest computer-animated films to be completely independently funded. Working apart from a major studio allowed the filmmakers greater creative control, but also restrained them economically. Due to the film's small budget, its animation was produced in the Philippines, with a less realistic design inspired by stop motion films. The Weinstein Company did not sign on as the film's distributor until near the end of production, and while the company had many roles recast, it otherwise made few changes to the film. Structurally, the film was inspired by non-linear crime dramas, such as Rashomon and Pulp Fiction. It was released shortly after the first two installments in the successful Shrek series, which accentuated the fairy tale parody genre of which it is a part. The film however, intentionally deviated from that series in its style of humor and in certain plot elements. This was in part based on Cory Edwards' concerns over exposing children to the high level of cynicism often found in the genre. Critical reception to the film was varied; although its script and cast were praised by many reviews, its animation quality was heavily criticized. The film was a commercial success, earning over thirteen times its less- than-$8 million budget. A sequel, Hoodwinked Too! Hood vs. Evil, directed by Mike Disa, and written by the Edwards brothers and Leech, was released in 2011 to negative reviews and financial failure."
6113,42738,Underworld: Evolution,"Action, Fantasy, Horror",2006,Movie not found on DBpedia by query title.
6114,42740,Looking for Comedy in the Muslim World,Comedy,2005,Movie not found on DBpedia by query title.
6115,42761,Casper Meets Wendy,"Adventure, Children, Comedy, Fantasy",1998,Movie not found on DBpedia by query title.
6116,42943,Revolution,"Adventure, Drama, War",1985,"Revolution is a documentary film by Jack O'Connell made in San Francisco in 1967. It was subsequently revived with added reminiscences. Although most interviewees are not named some of them have been identified, such as Kurt Hirschhorn, Frank Jordan, Cecil Williams and Herb Caen Daria Halprin appears in the film as herself. Also appearing in the film are the Ace of Cups, Country Joe and the Fish, and Dan Hicks."
6117,42946,Project A ('A' gai waak),"Action, Comedy",1983,Movie not found on DBpedia by query title.
6118,43289,"Bird People in China, The (Chûgoku no chôjin)","Adventure, Comedy, Drama, Fantasy",1998,Movie not found on DBpedia by query title.
6119,43333,Water,"Drama, Romance",2005,"(This article is about the 1985 comedy film. For the article about the Indian drama, see Water (2005 film).) Water is a 1985 British comedy film scripted by Dick Clement and Ian La Frenais, directed by Clement, and starring Michael Caine. This HandMade Films production was released in US cinemas in April 1986 by Atlantic Releasing."
6120,43376,Sophie Scholl: The Final Days (Sophie Scholl - Die letzten Tage),"Drama, War",2005,Movie not found on DBpedia by query title.
6121,43396,"World's Fastest Indian, The",Drama,2005,Movie not found on DBpedia by query title.
6122,43419,Bandidas,"Action, Comedy, Crime, Western",2006,"Bandidas is a 2006 French-Mexican-American Western action comedy film starring Salma Hayek and Penélope Cruz directed by Norwegian directors Joachim Rønning and Espen Sandberg and produced and written by Luc Besson. It tells the tale of two very different women in mid-19th century Mexico who become a bank robbing duo in an effort to combat a ruthless enforcer terrorising their town. This is the first movie that Cruz and Hayek starred in together. It was a co-production among France, the United States and Mexico."
6123,43460,Tristram Shandy: A Cock and Bull Story,"Comedy, Drama",2005,Movie not found on DBpedia by query title.
6124,43549,Helter Skelter,"Action, Crime, Drama, Horror",2004,Movie not found on DBpedia by query title.
